pmid,title,authors,affiliations,journal,pub_date,doi,citations,keywords,abstract,search_query,impact_factor,quartile,journal_full_name
37685892,Identification and Quantification of the Major Phenolic Constituents in Castanea sativa and Commercial Interspecific Hybrids (C. sativa x C. crenata) Chestnuts Using HPLC-MS/MS.,Medic Aljaz; Kunc Petra; Zamljen Tilen; Hudina Metka; Veberic Robert; Solar Anita,"Biotechnical Faculty, Department of Agronomy, University of Ljubljana, Jamnikarjeva 101, SI-1000 Ljubljana, Slovenia.",International journal of molecular sciences,2023-08-23,10.3390/ijms241713086,0,"Chromatography, High Pressure Liquid; phenolic compounds; dicarboxylic acid; HPLC-MS; chestnut; Tandem Mass Spectrometry; Phenols; Fagaceae; wild accessions","Due to the lack of studies on chestnut metabolites, this study was conducted to identify and quantify the major phenolic constituents in chestnuts. Data were compared with the three most commonly grown interspecific hybrids of C. sativa and C. crenata ('Bouche de Betizac', 'Marsol', and 'Maraval') and three ""native"" accessions of C. sativa. High-performance liquid chromatography coupled with mass spectrometry was used to identify and quantify these compounds. Four dicarboxylic acid derivatives, five hydroxybenzoic acids, nine hydroxycinnamic acids, and three flavanols were identified and quantified, most of them for the first time. Hydroxybenzoic acids were the major phenolic compounds in all chestnut cultivars/accessions, followed by flavanols, dicarboxylic acid derivatives, and hydroxycinnamic acids. Of all the compounds studied, the (epi)catechin dimer was the most abundant in chestnut. The assumption that cultivars from commercial hybrids have a better and different metabolic profile than ""native"" accessions was refuted.",Castanea,5.6,Q1,International Journal of Molecular Sciences
37711616,Castanea crenata honey reduces influenza infection by activating the innate immune response.,Kwon Eun-Bin; Kim Se-Gun; Kim Young Soo; Kim Buyun; Han Sang Mi; Lee Hye Jin; Choi Hong Min; Choi Jang-Gi,"Korean Medicine Application Center, Korea Institute of Oriental Medicine, Daegu, Republic of Korea.; Department of Agricultural Biology, National Institute of Agricultural Sciences, Rural Development Administration, Wanju, Republic of Korea.",Frontiers in immunology,2023-08-22,10.3389/fimmu.2023.1157506,0,"Mice; retinoic acid-inducible gene-1; IFN-inducible transmembrane 3; Influenza Vaccines; mitochondrial antiviral signaling protein; Influenza, Human; Immunity, Innate; Orthomyxoviridae Infections; Antiviral Agents; Castanea crenata honey; interferon; Animals; Honey; influenza A virus; Humans","Influenza is an acute respiratory disorder caused by the influenza virus and is associated with prolonged hospitalization and high mortality rates in older individuals and chronically ill patients. Vaccination is the most effective preventive strategy for ameliorating seasonal influenza. However, the vaccine is not fully effective in cases of antigenic mismatch with the viral strains circulating in the community. The emergence of resistance to antiviral drugs aggravates the situation. Therefore, developing new vaccines and antiviral drugs is essential. Castanea crenata honey (CH) is an extensively cultivated food worldwide and has been used as a nutritional supplement or herbal medicine. However, the potential anti-influenza properties of CH remain unexplored. In this study, the in vitro and in vivo antiviral effects of CH were assessed. CH significantly prevented influenza virus infection in mouse Raw264.7 macrophages. CH pretreatment inhibited the expression of the viral proteins M2, PA, and PB1 and enhanced the secretion of proinflammatory cytokines and type-I interferon (IFN)-related proteins in vitro. CH increased the expression of RIG-1, mitochondrial antiviral signaling (MAVS) protein, and IFN-inducible transmembrane protein, which interferes with virus replication. CH reduced body weight loss by 20.9%, increased survival by 60%, and decreased viral replication and inflammatory response in the lungs of influenza A virus-infected mice. Therefore, CH stimulates an antiviral response in murine macrophages and mice by preventing viral infection through the RIG-1-mediated MAVS pathway. Further investigation is warranted to understand the molecular mechanisms involved in the protective effects of CH on influenza virus infection.",Castanea,5.6,Q1,Frontiers in Plant Science
36325569,Integrative quantitative and qualitative analysis for the quality evaluation and monitoring of Danshen medicines from different sources using HPLC-DAD and NIR combined with chemometrics.,Li Qing; Qi Luming; Zhao Kui; Ke Wang; Li Tingting; Xia Lina,"School of Chemistry, Biology and Environment, Yuxi Normal University, Yuxi, China.; Chengdu Institute for Food and Drug Control, Chengdu, China.; School of Health Preservation and Rehabilitation, Chengdu University of Traditional Chinese Medicine, Chengdu, China.; State Administration of Traditional Chinese Medicine, Key Laboratory of Traditional Chinese Medicine Regimen and Health, Chengdu, China.; College of Materials Science and Engineering, Southwest Forestry University, Kunming, China.; School of Big Data and Artificial Intelligence, Chengdu Technological University, Chengdu, China.",Frontiers in plant science,2022-10-17,10.3389/fpls.2022.932855,0,chemometric models; Salvia medicines; HPLC-DAD; NIR; quality evaluation and monitoring,"The root and rhizome of Salvia miltiorrhiza (Danshen in short) is a well-known herbal medicine used to treat cardiovascular diseases in the world. In China, the roots and rhizomes of several other Salvia species (Non-Danshen in short) are also used as this medicine in traditional folk medicine by local herbalists. Differences have been reported in these medicines originating from different sources, and their quality variation needs to be clearly investigated for effective clinical application. This study presented a comprehensive quality evaluation and monitoring for Danshen from 27 sampling sites and Non-Danshen from other 5 Salvia species based on a high-performance liquid chromatography-diode array detector (HPLC-DAD) and near-infrared (NIR), with the combination of chemometric models. The results showed that cryptotanshinone, tanshinone IIA, tanshinone I, salvianolic acid B, salvianic acid A sodium, dihydrotanshinone I, and rosmarinic acid in these medicines from different sources exhibited great variations. Referring to the standards in Chinese Pharmacopoeia (CP), European Pharmacopeia (EP), and United States Pharmacopeia (USP), Non-Danshen from S. brachyloma, S. castanea, S. trijuga, S. bowleyana, and S. przewalskii were assessed as unqualified, and Danshen in the Shandong Province had the best quality due to the high qualified rate. Based on random forest (RF) and partial least-squares discriminant analysis (PLS-DA), NIR technique could successfully monitor the quality of these medicines by discriminating the species and regions with the accuracies of 100.00 and 99.60%, respectively. Additionally, modified partial least-squares regression (MPLSR) models were successfully constructed to investigate the feasibility of NIR fingerprints for the prediction of the quality indicators in these medicines. The optimized models obtained the best results for the total of tanshinone IIA, tanshinone I, and cryptotanshinone (TTC), tanshinone IIA, and salvianolic acid B, with the relative prediction deviation (RPD) of 4.08, 3.92, and 2.46, respectively. In summary, this study demonstrated that HPLC-DAD and NIR techniques can complement each other and could be simultaneously applied for evaluating and monitoring the quality of Danshen medicines.",Castanea,5.6,Q1,Frontiers in plant science
39524560,Whole genome sequencing of Castanea mollissima and molecular mechanisms of sugar and starch synthesis.,Li Rongchen; Huang Xiaolu; Yang Liping; Liao Jianming; Wei Xiaojuan; Li Junji; Zeng Guangyu; Liu Dan; Shi Zhuogong; Zhao Zhiheng,"Guangxi Forestry Research Institute, Guangxi Forestry Research Institute, Guangxi Forestry Laboratory, Guangxi Key Laboratory of Special Non-wood Forests Cultivation and Utilization, Nanning, China.; College of Biological Sciences and Biotechnology, National Engineering Research Center for Forest Tree Breeding and Ecological Remediation, Key Laboratory of Genetics and Breeding in Forest Trees and Ornamental Plants, Ministry of Education, The Tree and Ornamental Plant Breeding and Biotechnology Laboratory of National Forestry and Grassland Administration, Beijing Forestry University, Beijing, China.; Shandong Provincial Center of Forest and Grass Germplasm Resources, Jinan, China.; Research Center for Plateau Characteristic Agriculture in Northeast Yunnan, College of Agriculture and Life Sciences, Zhaotong University, Zhaotong, China.",Frontiers in plant science,2024-10-25,10.3389/fpls.2024.1455885,0,sugar and starch metabolism; time-ordered gene co-expression network; pollen xenia; chestnut; telomere-to-telomere genome assembly,"The chestnut tree exhibits self-incompatibility, where the selection of the male parent (pollen xenia) significantly affects seed starch metabolism, as well as fruit yield and quality. Despite its importance, the molecular mechanisms underlying pollen xenia remains largely unknown. In this study, we utilized the 'Lan You' variety of C. mollissima to construct a high-quality reference genome. As a result, a first Telomere-to-telomere (T2T) gap-free genome for this species was successfully assembled. A total of 560 transcription factors and 22 structural genes were identified as consistent across the TO-GCNs, indicating a consistent regulation pattern in the co-expression of genes involved in starch accumulation. These networks were further divided into three sub-networks: T1, T2, and T3. Among these, the T1 and T2 sub-networks exhibited a higher number of structural genes with consistent regulation patterns and were closely associated with sugar biosynthesis. The gene SBE (Camol08G0254600) was identified as the hub gene with the highest degree of connectivity, encoding a key rate-limiting enzyme in the amylopectin biosynthesis pathway. This study provides a foundation for further research on C. mollissima population genetics, genetic improvement, and strategies aimed at enhancing yield and quality.",Castanea,5.6,Q1,Frontiers in plant science
35309951,Integrated Transcriptomics and Proteomics to Reveal Regulation Mechanism and Evolution of SmWRKY61 on Tanshinone Biosynthesis in Salvia miltiorrhiza and Salvia castanea.,Chen Yue; Wang Yanting; Guo Juan; Yang Jian; Zhang Xiaodan; Wang Zixuan; Cheng Ying; Du Zewei; Qi Zhechen; Huang Yanbo; Dennis Mans; Wei Yukun; Yang Dongfeng; Huang Luqi; Liang Zongsuo,"College of Life Sciences and Medicine, Key Laboratory of Plant Secondary Metabolism and Regulation in Zhejiang Province, Zhejiang Sci-Tech University, Hangzhou, China.; State Key Laboratory of Dao-di Herbs, National Resource Center for Chinese Materia Medica, China Academy of Chinese Medical Sciences, Beijing, China.; Eastern China Conservation Centre for Wild Endangered Plant Resources, Shanghai Chenshan Botanical Garden, Shanghai, China.; Faculty of Medical Sciences, Anton de Kom University of Suriname, Paramaribo, Suriname.",Frontiers in plant science,2022-03-03,10.3389/fpls.2021.820582,0,Salvia Linn; Salvia miltiorrhiza; transcriptome; proteome; secondary metabolism; WRKYs,"Tanshinones found in Salvia species are the main active compounds for the treatment of cardiovascular and cerebrovascular diseases, but their contents are hugely different in different species. For example, tanshinone IIA content in Salvia castanea Diels f. tomentosa Stib. is about 49 times higher than that in Salvia miltiorrhiza Bunge. The molecular mechanism responsible for this phenomenon remains largely unknown. To address this, we performed comparative transcriptomic and proteomic analyses of S. miltiorrhiza and S. castanea. A total of 296 genes in S. castanea and 125 genes in S. miltiorrhiza were highly expressed at both the transcriptional and proteome levels, including hormone signal regulation, fungus response genes, transcription factors, and CYP450. Among these differentially expressed genes, the expression of SmWRKY61 was particularly high in S. castanea. Overexpression of SmWRKY61 in S. miltiorrhiza could significantly increase the content of tanshinone I and tanshinone IIA, which were 11.09 and 33.37 times of the control, respectively. Moreover, SmWRKY61 had a strong regulatory effect, elevating the expression levels of tanshinone pathway genes such as DXS2, CMK, HMGS2, 1, KSL1, KSL2, CYP76AH1, and CYP76AK3. For the WRKY family, 79 SmWRKYs were originally obtained and classified into three main groups. Collinearity analysis indicated a more specific extension of WRKY gene family in Salvia genus. In 55 Salvia species, only 37 species contained the WRKY61 sequence, and high SmWRKY61 expression in some Salvia L. species was often accompanied by high tanshinone accumulation. The above results suggest that SmWRKY61 is a highly effective regulator of tanshinone accumulation and may be a key factor resulting in high tanshinone accumulation in S. castanea.",Castanea,5.6,Q1,Frontiers in plant science
35814202,"Recent Advances and Perspectives on the Health Benefits of Urolithin B, A Bioactive Natural Product Derived From Ellagitannins.",Chen Peng; Guo Zhiei; Chen Fuchao; Wu Yue; Zhou Benhong,"Department of Pharmacy, Renmin Hospital of Wuhan University, Wuhan, China.; Department of Pharmacy, Wuhan Fourth Hospital, Puai Hospital, Tongji Medical College, Huazhong University of Science and Technology, Wuhan, China.; Sinopharm Dongfeng General Hospital, Hubei University of Medicine, Shiyan, China.",Frontiers in pharmacology,2022-06-22,10.3389/fphar.2022.917266,0,biological effect; urolithin B; antioxidant; anti-aging; nutritional agent,"Urolithin (Uro) B is a natural compound produced by gut bacteria from ingested ellagitannins (ETs) and ellagic acid (EA), complex polyphenols abundant in foods such as pomegranates, raspberries, blueberries and chestnuts. Uro B has recently garnered considerable attention owing to its wide range of nutraceutical effects and relatively high potency. According to several studies, Uro B prevents the development of hyperlipidemia, cardiovascular disease (CVD) and tumors due to its strong antioxidant and anti-inflammatory properties. Many reviews have systematically summarized the health benefits and pharmacological activities of ETs, EA and urolithins (especially Uro A) while available reviews or detailed summaries on the positive impact of Uro B are rarer. Here, we sought to review the pharmacological activity, mechanism of action, regulation of immune function and its associated diseases and preventive potential of Uro B to elucidate its function as a nutritional agent in humans.",chestnut,5.2,Q1,Frontiers in Public Health
35122694,Temporal changes in pathogen diversity in a perennial plant-pathogen-hyperparasite system.,Stauber Lea; Croll Daniel; Prospero Simone,"Swiss Federal Institute for Forest, Snow and Landscape Research (WSL), Birmensdorf, Switzerland.; Laboratory of Evolutionary Genetics, Institute of Biology, University of Neuchâtel, Neuchâtel, Switzerland.; Department of Environmental Sciences, University of Basel, Basel, Switzerland.",Molecular ecology,2022-02-16,10.1111/mec.16386,0,Plant Diseases; evolutionary dynamics; Fagaceae; Virulence; biological control; Ascomycota; biological invasion; RNA Viruses; Fungal Viruses; vegetative incompatibility,"Hyperparasites can affect the evolution of pathosystems by influencing the stability of both pathogen and host populations. However, how pathogens of perennial hosts evolve in the presence of a hyperparasite has rarely been studied. Here, we investigated temporal changes in genetic diversity of the invasive chestnut blight pathogen Cryphonectria parasitica in the presence of its parasitic mycovirus Cryphonectria hypovirus 1 (CHV1). The virus reduces fungal virulence and represents an effective natural biocontrol agent against chestnut blight in Europe. We analysed genome-wide diversity and CHV1 prevalence in C. parasitica populations in southern Switzerland that were sampled twice at an interval of about 30 years. Overall, we found that both pathogen population structure and CHV1 prevalence were retained over time. The results suggest that recent bottlenecks have influenced the structure of C. parasitica populations in southern Switzerland. Strong balancing selection signals were found at a single vegetative incompatibility (vic) locus, consistent with negative frequency-dependent selection imposed by the vegetative incompatibility system. High levels of mating among related individuals (i.e., inbreeding) and genetic drift are probably at the origin of imbalanced allele ratios at vic loci and subsequently low vc type diversity. Virus infection rates were stable at ~30% over the study period and we found no significant impact of the virus on fungal population diversity. Consequently, the efficacy of CHV1-mediated biocontrol was probably retained.",chestnut,4.9,Q1,Molecular ecology
34841616,Pathogen-induced expression of a blight tolerance transgene in American chestnut.,Carlson Erik; Stewart Kristen; Baier Kathleen; McGuigan Linda; Culpepper Tobi; Powell William,"Department of Environmental Biology, SUNY College of Environmental Science and Forestry, Syracuse, New York, USA.",Molecular plant pathology,2021-11-28,10.1111/mpp.13165,0,Plant Diseases; Castanea dentata; blight tolerance; Oxalates; Fagaceae; Cryphonectria parasitica; oxalate oxidase (OxO); Ascomycota; Trees; win3.12 poplar promoter; Transgenes; Plant Breeding,"American chestnut (Castanea dentata) is a susceptible host of the invasive necrotrophic fungus Cryphonectria parasitica, which causes chestnut blight disease. The fungal pathogen attacks chestnut stems by invading wounded tissue and secreting oxalate. This process leads to the death of infected host cells and the formation of cankers, eventually girdling stems and killing the tree above the infections. To reduce damage caused by fungal oxalate, American chestnut has been genetically engineered to express a wheat oxalate oxidase (OxO). This enzyme degrades the oxalate produced by the pathogen and confers elevated tolerance to Cryphonectria parasitica infection. We report new lines of transgenic American chestnut that have been developed with the win3.12 inducible promoter from poplar (Populus deltoides) driving OxO expression. This promoter is responsive to both wounding and pathogen infection, with a low level of baseline expression. Targeted expression of OxO to wounded and infected tissue is sought as an alternative to constitutive expression for potential metabolic resource conservation and transgene stability over the long lifetime of a tree and over successive generations of breeding. Transgenic Castanea dentata lines harbouring the win3.12-OxO construct were evaluated for transgene expression patterns and tolerance to chestnut blight infection. OxO transcript levels were low in uninfected plants, but robust infection-induced expression levels were observed, with one transgenic line reaching levels comparable to those of previously characterized CaMV35S-OxO lines. In chestnut blight infection bioassays, win3.12-OxO lines showed elevated disease tolerance similar to blight-resistant Chinese chestnut (Castanea mollissima) controls.",Castanea,4.8,Q1,Molecular Plant Pathology
39194852,Inhibitory Effects and Mechanisms of Perilla Essential Oil and Perillaldehyde against Chestnut Pathogen Botryosphaeria dothidea.,Zeng Qi; Wang Lu; Long Sha; Dong Wanrong; Li Yaoyao; Chen Yuxin; Zhou Gao,"Hubei Key Laboratory of Industrial Microbiology, Key Laboratory of Fermentation Engineering (Ministry of Education), Cooperative Innovation Center of Industrial Fermentation (Ministry of Education & Hubei Province), Hubei University of Technology, Wuhan 430068, China.; National ""111"" Center for Cellular Regulation and Molecular Pharmaceutics, School of Life and Health Sciences, Hubei University of Technology, Wuhan 430068, China.; Post-Doctoral Research Center of Mayinglong Pharmaceutical Group Co., Ltd., Wuhan 430064, China.","Journal of fungi (Basel, Switzerland)",2024-07-28,10.3390/jof10080526,0,Botryosphaeria dothidea; perilla; essential oil; perillaldehyde; antifungal mechanism,"Botryosphaeria dothidea, a notorious plant pathogen, is responsible for causing chestnut rot during postharvest storage. This research aimed to assess the antifungal properties of perilla essential oil (PEO) and perillaldehyde (PAE) against B. dothidea. PEO's and PAE's inhibitory effects on B. dothidea were investigated using an agar dilution method, a fumigation method, and an in vivo assay in chestnuts and shell buckets. Based on the results of gas chromatography-mass spectrometry, it was confirmed that the main component of PEO was elemicin. The antifungal mechanism of PEO and PAE against B. dothidea was investigated by conducting staining experiments of the fungal cell wall and cell membrane. PEO and PAE strongly inhibit the mycelial growth of B. dothidea in a dose-dependent manner. The inhibitory mechanism is mainly related to the destruction of the integrity of the fungal cell wall and plasma membrane. Notably, PEO retains its antifungal efficacy against B. dothidea in chestnuts, effectively prolonging their storage life. These findings indicate that PEO and PAE are nontoxic, eco-friendly botanical fungicides, holding promise for controlling postharvest chestnut rot.",chestnut,4.7,Q2,Journal of Fungi
36765115,Design and experiment of a combined peeling machine for water chestnut.,Zhang Guozhong; Chen Liming; Guo Zhou; Liu Haopeng; Dong Zhao; Liang Fang,"College of Engineering, Huazhong Agricultural University, Wuhan, 430070, China. zhanggz@mail.hzau.edu.cn.; Key Laboratory of Agricultural Equipment in Mid-lower Yangtze River, Ministry of Agriculture and Rural Affairs, Wuhan, 430070, China. zhanggz@mail.hzau.edu.cn.; College of Engineering, Huazhong Agricultural University, Wuhan, 430070, China.; Key Laboratory of Agricultural Equipment in Mid-lower Yangtze River, Ministry of Agriculture and Rural Affairs, Wuhan, 430070, China.",Scientific reports,2023-02-10,10.1038/s41598-023-28472-9,0,Vegetables; Eleocharis; China; Fruit,"Water chestnut is a characteristic aquatic vegetable in China, and its demand for peeling fresh fruit is increasing rapidly. Aiming at the existing problems of high labor intensity and low efficiency of manual peeling, a combined water chestnut peeling machine was designed, which used a rotary knife to remove bud and root, and a differential friction belts to remove side peel. The performance of the peeling machine was tested with water chestnut from Xiaogan, Hubei Provence. Under the conditions of 200 g feeding mass and 10 r/min rotation speed, the single factor test was carried out with cutting speed as the influencing factor and the cutting rate of bud and root as the evaluation index. The results showed that the cutting rate of fresh fruit of water chestnut bud and root were 79.04% and 83.77% respectively when the cutting speed of rotary knife was 1.2 m/s. In the differential friction belts, high and low linear velocities were taken as the influencing factors, and the side peel removal rate was used as the evaluation index. The side peel removal rate was 84.93% at the high-speed linear velocity of 2.1 m/s and the low-speed linear velocity of 1.58 m/s. The performance of the whole machine was evaluated, and the results showed that the working loss of the combined water chestnut peeling machine was 43.03% and the comprehensive peeling rate was 77.43%, which reached the design requirements. This study can provide a reference for the research and development of water chestnut peeling device.",chestnut,4.6,Q2,Scientific reports
