pmid,title,authors,affiliations,journal,pub_date,doi,citations,keywords,abstract,search_query,impact_factor,quartile,journal_full_name
38234686,Fungal Planet description sheets: 1383-1435.,Crous P W; Boers J; Holdom D; Osieck E R; Steinrucken T V; Tan Y P; Vitelli J S; Shivas R G; Barrett M; Boxshall A-G; Broadbridge J; Larsson E; Lebel T; Pinruan U; Sommai S; Alvarado P; Bonito G; Decock C A; De la Peña-Lastra S; Delgado G; Houbraken J; Maciá-Vicente J G; Raja H A; Rigueiro-Rodríguez A; Rodríguez A; Wingfield M J; Adams S J; Akulov A; Al-Hidmi T; Antonín V; Arauzo S; Arenas F; Armada F; Aylward J; Bellanger J-M; Berraf-Tebbal A; Bidaud A; Boccardo F; Cabero J; Calledda F; Corriol G; Crane J L; Dearnaley J D W; Dima B; Dovana F; Eichmeier A; Esteve-Raventós F; Fine M; Ganzert L; García D; Torres-Garcia D; Gené J; Gutiérrez A; Iglesias P; Istel Ł; Jangsantear P; Jansen G M; Jeppson M; Karun N C; Karich A; Khamsuntorn P; Kokkonen K; Kolařík M; Kubátová A; Labuda R; Lagashetti A C; Lifshitz N; Linde C; Loizides M; Luangsa-Ard J J; Lueangjaroenkit P; Mahadevakumar S; Mahamedi A E; Malloch D W; Marincowitz S; Mateos A; Moreau P-A; Miller A N; Molia A; Morte A; Navarro-Ródenas A; Nebesářová J; Nigrone E; Nuthan B R; Oberlies N H; Pepori A L; Rämä T; Rapley D; Reschke K; Robicheau B M; Roets F; Roux J; Saavedra M; Sakolrak B; Santini A; Ševčíková H; Singh P N; Singh S K; Somrithipol S; Spetik M; Sridhar K R; Starink-Willemse M; Taylor V A; van Iperen A L; Vauras J; Walker A K; Wingfield B D; Yarden O; Cooke A W; Manners A G; Pegg K G; Groenewald J Z,"Westerdijk Fungal Biodiversity Institute, P.O. Box 85167, 3508 AD Utrecht, The Netherlands.; Department of Biochemistry, Genetics and Microbiology, Forestry and Agricultural Biotechnology Institute (FABI), University of Pretoria, Pretoria, South Africa.; Moleneinde 15, 7991 AK, Dwingeloo, The Netherlands.; Biosecurity Queensland, Dutton Park 4102, Queensland, Australia.; Jkvr. C.M. van Asch van Wijcklaan 19, 3972 ST Driebergen-Rijsenburg, The Netherlands.; CSIRO, Dutton Park 4102, Queensland, Australia.; Plant Pathology Herbarium, Department of Agriculture and Fisheries, Dutton Park 4102, Queensland, Australia.; Centre for Crop Health, University of Southern Queensland, Toowoomba 4350, Queensland, Australia.; James Cook University, Cairns, Queensland, Australia.; University of Melbourne, Victoria, Australia.; University of Adelaide, South Australia, Australia.; Biological and Environmental Sciences, Gothenburg Global Biodiversity Centre, University of Gothenburg, Box 461, SE-40530 Göteborg, Sweden.; State Herbarium of South Australia, South Australia, Australia.; Plant Microbe Interaction Research Team (APMT), BIOTEC, National Science and Technology Development Agency, Pathum Thani, Thailand, 113 Thailand Science Park, Phahonyothin Rd., Khlong Nueng, Khlong Luang, Pathum Thani Thailand.; ALVALAB, Dr. Fernando Bongera st., Severo Ochoa bldg. S1.04, 33006 Oviedo, Spain.; Michigan State University, East Lansing, Michigan, USA.; Mycothèque de l'Université catholique de Louvain (MUCL, BCCMTM), Earth and Life Institute - ELIM - Mycology, Université catholique de Louvain, Croix du Sud 2 bte L7.05.06, B-1348 Louvain-la-Neuve, Belgium.; University of Santiago de Compostela, Spain.; Eurofins EMLab P&K Houston, 10900 Brittmoore Park Dr. Suite G, Houston, Texas 77041, USA.; Plant Ecology and Nature Conservation, Wageningen University & Research, P.O. Box 47, 6700 AA Wageningen, The Netherlands.; Department of Microbial Ecology, Netherlands Institute for Ecology (NIOO-KNAW), P.O. Box 50, 6700 Wageningen, The Netherlands.; Department of Chemistry and Biochemistry, University of North Carolina at Greensboro, Greensboro, North Carolina 27402, USA.; Departamento de Biología Vegetal (Botánica), Facultad de Biología, Universidad de Murcia, 30100 Murcia, Spain.; Department of Biology, Acadia University, 33 Westwood Avenue, Wolfville, Nova Scotia, B4P 2R6 Canada.; Department of Mycology and Plant Resistance, V. N. Karazin Kharkiv National University, Maidan Svobody 4, 61022 Kharkiv, Ukraine.; Department of Botany, Moravian Museum, Zelný trh 6, 65937 Brno, Czech Republic.; Asociación Micológica Errotari de Durango, Spain.; 203, montée Saint-Mamert-le-Haut, F-38138 Les Côtes-d'Arey, France.; CEFE, CNRS, Université de Montpellier, EPHE, IRD, INSERM, 1919 route de Mende, F-34293 Montpellier Cédex 5, France.; MENDELEUM - Institute of Genetics, Mendel University in Brno, Valticka 334, Lednice, 69144, Czech Republic.; 2436, route de Brailles, F-38510 Vézeronce-Curtin, France.; Via Filippo Bettini 14/11, 16162, Genova, Italy.; C/ El Sol 6. 49800 Toro, Zamora, Spain.; Via 25 aprile, 76, 20051, Cassina De Pecchi (MI), Italy.; National Botanical Conservatory of the Pyrenees and Midi-Pyrenees. Vallon de Salut, BP 70315, 65203 Bagnères-de-Bigorre, France.; University of Illinois Urbana-Champaign, Illinois Natural History Survey, 1816 South Oak Street, Champaign, Illinois, 61820, USA.; Department of Plant Anatomy, Institute of Biology, Eötvös Loránd University, Pázmány Péter sétány 1/C, H-1117, Budapest, Hungary.; Via Quargnento, 17, 15029, Solero (AL), Italy.; Departemento de Ciencias de la Vida, Botánica, Universidad de Alcalá. Alcalá de Henares, E28805 Madrid, Spain.; Department of Ecology, Evolution & Behavior, The Alexander Silberman Institute of Life Science, The Hebrew University of Jerusalem, Jerusalem, Israel & Interuniversity Institute of Marine Sciences, Eilat, Israel.; Marbio, Norwegian College of Fishery Science, UiT The Arctic University of Norway, Tromsø, Norway.; Mycology Unit, Medical School and IISPV, Universitat Rovira i Virgili, Sant Llorenç 21, 43201 Reus, Spain.; Forest and Plant Conservation Research Office, Department of National Parks, Wildlife and Plant Conservation, Chatuchak District, Bangkok, Thailand.; 6703 JC Wageningen, The Netherlands.; Department of Biosciences, Mangalore University, Mangalagangotri, Mangalore 574199, Karnataka, India.; TU Dresden, International Institute Zittau, Markt 23, 02763 Zittau, Germany.; Biodiversity Unit, Herbarium, University of Turku, FI-20014 Turku, Finland.; Institute of Microbiology of the CAS, Vídeňská 1083, 14220, Prague, Czech Republic.; Department of Botany, Culture Collection of Fungi (CCF), Faculty of Science, Charles University, Benátská 2, 128 00 Prague 2, Czech Republic.; Department for Farm Animals and Veterinary Public Health, Institute of Food Safety, Food Technology and Veterinary Public Health; Unit of Food Microbiology, University of Veterinary Medicine Vienna, Veterinaerplatz 1, 1210 Vienna, Austria, and Research Platform Bioactive Microbial Metabolites (BiMM), Konrad Lorenz Strasse 24, 3430 Tulln a.d. Donau, Austria.; National Fungal Culture Collection of India (NFCCI), Biodiversity and Palaeobiology Group, MACS-Agharkar Research Institute, G.G. Agarkar Road, Pune 411004, India.; Department of Plant Pathology and Microbiology, The Robert H. Smith Faculty of Agriculture, The Hebrew University of Jerusalem, Rehovot, Israel & Interuniversity Institute of Marine Sciences, Eilat, Israel.; Ecology and Evolution, Research School of Biology, College of Science, The Australian National University, Canberra, ACT, 2601, Australia.; P.O. Box 58499, 3734 Limassol, Cyprus.; Department of Microbiology, Faculty of Science, Kasetsart University, Bangkok, Thailand.; Department of Studies in Botany, University of Mysore, Manasagangotri, Mysore 570006, Karnataka, India; Present Address: Forest Pathology Department, Division of Forest Protection, KSCSTE - Kerala Forest Research Institute, Peechi 680653, Thrissur, Kerala, India.; Laboratoire de Biologie des Systèmes Microbiens (LBSM), Ecole Normale Supérieure de Kouba, B.P 92 16308 Vieux-Kouba, Alger, Algeria.; New Brunswick Museum, 277 Douglas Ave., Saint John, New Brunswick, Canada E2K 1E5.; Sociedad Micológica Extremeña, C/ Sagitario 14, 10001 Cáceres, Spain.; ULR 4515 - LGCgE, Faculté de pharmacie, Univ. Lille, F-59000 Lille, France.; Alette Iversens gate 5, N-3970 Langesund, Norway.; Laboratory of Electron Microscopy, Faculty of Science, Charles University, Viničná 7, 128 00 Prague 2, Czech Republic.; Institute of Sustainable Plant Protection, C.N.R. Via Madonna del Piano, 10 50019 Sesto fiorentino, Italy.; Department of Studies in Microbiology, University of Mysore, Manasagangotri, Mysore 570006, Karnataka, India.; Mycology Research Group, Faculty of Biological Sciences, Goethe University Frankfurt am Main, Max-von-Laue Straße 13, 60439 Frankfurt am Main, Germany.; Department of Biology, Dalhousie University, 1355 Oxford Street, Halifax, Nova Scotia, B3H 4R2 Canada.; Department of Conservation Ecology and Entomology, Stellenbosch University, Stellenbosch 7600, South Africa.; Department of Plant and Soil Sciences, Forestry and Agricultural Biotechnology Institute (FABI), Faculty of Natural and Agricultural Sciences, University of Pretoria, Private Bag X20, Hatfield 0028, Pretoria, South Africa.; Asociación ""Andoa"" de Cambre y componente del ""Colectivo Micolóxico Coruñés"" de A Coruña, Spain.; Faculty of Medicine, Dalhousie University, 5849 University Ave, Halifax, Nova Scotia B3H 4R2 Canada.; Biological Collections of Åbo Akademi University, Herbarium, University of Turku, FI-20014 Turku, Finland.; Agri-Science Queensland, Department of Agriculture and Fisheries, Dutton Park 4102, Queensland, Australia.",Persoonia,2022-07-12,10.3767/persoonia.2023.48.08,0,LSU; new taxa; ITS nrDNA barcodes; systematics,"Novel species of fungi described in this study include those from various countries as follows: Australia, Agaricus albofoetidus, Agaricus aureoelephanti and Agaricus parviumbrus on soil, Fusarium ramsdenii from stem cankers of Araucaria cunninghamii, Keissleriella sporoboli from stem of Sporobolus natalensis, Leptosphaerulina queenslandica and Pestalotiopsis chiaroscuro from leaves of Sporobolus natalensis, Serendipita petricolae as endophyte from roots of Eriochilus petricola, Stagonospora tauntonensis from stem of Sporobolus natalensis, Teratosphaeria carnegiei from leaves of Eucalyptus grandis × E. camaldulensis and Wongia ficherai from roots of Eragrostis curvula. Canada, Lulworthia fundyensis from intertidal wood and Newbrunswickomyces abietophilus (incl. Newbrunswickomyces gen. nov.) on buds of Abies balsamea. Czech Republic, Geosmithia funiculosa from a bark beetle gallery on Ulmus minor and Neoherpotrichiella juglandicola (incl. Neoherpotrichiella gen. nov.) from wood of Juglans regia. France, Aspergillus rouenensis and Neoacrodontium gallica (incl. Neoacrodontium gen. nov.) from bore dust of Xestobium rufovillosum feeding on Quercus wood, Endoradiciella communis (incl. Endoradiciella gen. nov.) endophytic in roots of Microthlaspi perfoliatum and Entoloma simulans on soil. India, Amanita konajensis on soil and Keithomyces indicus from soil. Israel, Microascus rothbergiorum from Stylophora pistillata. Italy, Calonarius ligusticus on soil. Netherlands, Appendopyricularia juncicola (incl. Appendopyricularia gen. nov.), Eriospora juncicola and Tetraploa juncicola on dead culms of Juncus effusus, Gonatophragmium physciae on Physcia caesia and Paracosmospora physciae (incl. Paracosmospora gen. nov.) on Physcia tenella, Myrmecridium phragmitigenum on dead culm of Phragmites australis, Neochalara lolae on stems of Pteridium aquilinum, Niesslia nieuwwulvenica on dead culm of undetermined Poaceae, Nothodevriesia narthecii (incl. Nothodevriesia gen. nov.) on dead leaves of Narthecium ossifragum and Parastenospora pini (incl. Parastenospora gen. nov.) on dead twigs of Pinus sylvestris. Norway, Verticillium bjoernoeyanum from sand grains attached to a piece of driftwood on a sandy beach. Portugal, Collybiopsis cimrmanii on the base of living Quercus ilex and amongst dead leaves of Laurus and herbs. South Africa, Paraproliferophorum hyphaenes (incl. Paraproliferophorum gen. nov.) on living leaves of Hyphaene sp. and Saccothecium widdringtoniae on twigs of Widdringtonia wallichii. Spain, Cortinarius dryosalor on soil, Cyphellophora endoradicis endophytic in roots of Microthlaspi perfoliatum, Geoglossum lauri-silvae on soil, Leptographium gemmatum from fluvial sediments, Physalacria auricularioides from a dead twig of Castanea sativa, Terfezia bertae and Tuber davidlopezii in soil. Sweden, Alpova larskersii, Inocybe alpestris and Inocybe boreogodeyi on soil. Thailand, Russula banwatchanensis, Russula purpureoviridis and Russula lilacina on soil. Ukraine, Nectriella adonidis on overwintered stems of Adonis vernalis. USA, Microcyclus jacquiniae from living leaves of Jacquinia keyensis and Penicillium neoherquei from a minute mushroom sporocarp. Morphological and culture characteristics are supported by DNA barcodes. Citation: Crous PW, Boers J, Holdom D, et al. 2022. Fungal Planet description sheets: 1383-1435. Persoonia 48: 261-371. https://doi.org/10.3767/persoonia.2022.48.08.",Castanea,,,
36771639,Warming Scenarios and Phytophthora cinnamomi Infection in Chestnut (Castanea sativa Mill.).,Dorado F Javier; Alías Juan Carlos; Chaves Natividad; Solla Alejandro,"Faculty of Forestry, Institute for Dehesa Research (INDEHESA), Avenida Virgen del Puerto 2, Universidad de Extremadura, 10600 Plasencia, Spain.; Department of Plant Biology, Ecology and Earth Sciences, Faculty of Science, Universidad de Extremadura, 06080 Badajoz, Spain.","Plants (Basel, Switzerland)",2023-01-26,10.3390/plants12030556,0,abiotic stress; biochemistry; climate change,"The main threats to chestnut in Europe are climate change and emerging pathogens. Although many works have separately addressed the impacts on chestnut of elevated temperatures and Phytophthora cinnamomi Rands (Pc) infection, none have studied their combined effect. The objectives of this work were to describe the physiology, secondary metabolism and survival of 6-month-old C. sativa seedlings after plants were exposed to ambient temperature, high ambient temperature and heat wave events, and subsequent infection by Pc. Ten days after the warming scenarios, the biochemistry of plant leaves and roots was quantified and the recovery effect assessed. Plant growth and root biomass under high ambient temperature were significantly higher than in plants under ambient temperature and heat wave event. Seven secondary metabolite compounds in leaves and three in roots were altered significantly with temperature. Phenolic compounds typically decreased in response to increased temperature, whereas ellagic acid in roots was significantly more abundant in plants exposed to ambient and high ambient temperature than in plants subjected to heat waves. At recovery, leaf procyanidin and catechin remained downregulated in plants exposed to high ambient temperature. Mortality by Pc was fastest and highest in plants exposed to ambient temperature and lowest in plants under high ambient temperature. Changes in the secondary metabolite profile of plants in response to Pc were dependent on the warming scenarios plants were exposed to, with five compounds in leaves and three in roots showing a significant 'warming scenario' × 'Pc' interaction. The group of trees that best survived Pc infection was characterised by increased quercetin 3-O-glucuronide, 3-feruloylquinic acid, gallic acid ethyl ester and ellagic acid. To the best of our knowledge, this is the first study addressing the combined effects of global warming and Pc infection in chestnut.",Castanea,,,
34327054,Morphological observation and protein expression of fertile and abortive ovules in Castanea mollissima.,Du Bingshuai; Zhang Qing; Cao Qingqin; Xing Yu; Qin Ling; Fang Kefeng,"Beijing Advanced Innovation Center for Tree Breeding by Molecular Design, Beijing University of Agriculture, Beijing, China.; College of Landscape Architecture, Beijing University of Agriculture, Beijing, China.; Key Laboratory for Agricultural Application and New Technique, College of Plant Science and Technology, Beijing University of Agriculture, Beijing, China.; Key Laboratory of Urban Agriculture (North China, Ministry of Agriculture P. R. China), Beijing University of Agriculture, Beijing, China.",PeerJ,2021-07-21,10.7717/peerj.11756,0,Castanea mollissima Blume; Abortive ovules; iTRAQ; Fertile ovules,"Chinese chestnuts (Castanea mollissima Blume.) contain 12-18 ovules in one ovary, but only one ovule develops into a seed, indicating a high ovule abortion rate. In this study, the Chinese chestnut 'Huaihuang' was used to explore the possible mechanisms of ovule abortion with respect to morphology and proteomics. The morphology and microstructure of abortive ovules were found to be considerably different from those of fertile ovules at 20 days after anthesis (20 DAA). The fertile ovules had completely formed tissues, such as the embryo sac, embryo and endosperm. By contrast, in the abortive ovules, there were no embryo sacs, and wide spaces between the integuments were observed, with few nucelli. Fluorescence labelling of the nuclei and transmission electron microscopy (TEM) observations showed that cells of abortive ovules were abnormally shaped and had thickened cell walls, folded cell membranes, condensed cytoplasm, ruptured nuclear membranes, degraded nucleoli and reduced mitochondria. The iTRAQ (isobaric tag for relative and absolute quantitation) results showed that in the abortive ovules, low levels of soluble protein with small molecular weights were found, and most of differently expressed proteins (DEPs) were related to protein synthesis, accumulation of active oxygen free radical, energy synthesis and so on. These DEPs might be associated with abnormal ovules formation.",Castanea,,,
36615589,Tannins-Based Extracts: Effects on Gut Chicken Spontaneous Contractility.,Mattioli Laura Beatrice; Corazza Ivan; Micucci Matteo; Pallavicini Marco; Budriesi Roberta,"Food Chemistry and Nutraceutical Lab, Department of Pharmacy and Biotechnology, Alma Mater Studiorum-University of Bologna, 40126 Bologna, Italy.; Department of Specialistic, Diagnostic and Experimental Medicine (DIMES), University of Bologna, S. Orsola-Malpighi University Hospital, Alma Mater Studiorum-University of Bologna, 40126 Bologna, Italy.; Department of Biomolecular Sciences, University of Urbino ""Carlo Bo"", 61029 Urbino, Italy.; Department of Pharmaceutical Sciences, University of Milano, 20129 Milan, Italy.","Molecules (Basel, Switzerland)",2023-01-03,10.3390/molecules28010395,0,Proanthocyanidins; Schinopsis balansae Engl. hardwood; spontaneous contractility; proximal colon; caecum; broiler chickens; ileum; gallbladder; Chickens; Castanea sativa Mill. wood; Hydrolyzable Tannins; chestnut: Silvafeed ENC; Animals; Quebracho: Silvafeed Q; tannins; Plant Extracts; Tannins; Humans,"The impossibility of using drugs for the health of farm animals leads to the search for alternative strategies with two purposes: to maintain animal health and safeguard human health. In this perspective, tannins have shown great promises. These phytocomplexes obtained from natural matrices with multiple health properties may be used as a feed supplement in chicken farms. In this work, we studied two tannin-based extracts (from Castanea sativa Mill. wood and from Schinopsis balansae Engl. Quebracho Colorado hardwood) with different chemical compositions on the spontaneous contractility on the isolated intestinal tissues of healthy chicken. The results showed that the chemical composition of the two phytocomplexes influenced the spontaneous intestinal contractility in different ways by regulating the tone and consequent progression of the food bolus. The chemical analysis of the two extracts revealed that Castanea sativa Mill. wood mainly contains hydrolysable tannins, while Schinopsis balansae Engl. hardwood mainly contains condensed tannins. The two phytocomplexes showed different effects towards gastrointestinal smooth muscle contractility, with Castanea sativa Mill. wood providing a better activity profile than Schinopsis balansae Engl. hardwood.",Castanea,,,
36977251,"The Role of Supplementing a Complex Phytobiotic Feed Additive Containing (Castanea sativa mill) Extract in Combination with Calcium Butyrate, Zinc-Methionine and Essential Oils on Growth Indicators, Blood Profile and Carcass Quality of Broiler Chickens.",Buryakov Nikolai P; Zagarin Artem Yu; Fathala Mohamed M; Aleshin Dmitrii E,"Department of Feeding Animals, Institute of Animal Science and Biology, Russian State Agrarian University-Moscow Timiryazev Agricultural Academy, 49 Timiryazevskaya Str., 127434 Moscow, Russia.; Scientific and Educational Laboratory of Advanced Technologies, Russian State Agrarian University-Moscow Timiryazev Agricultural Academy, 49 Timiryazevskaya Str., 127434 Moscow, Russia.; Animal Husbandry and Wealth Development Department, Faculty of Veterinary Medicine, Alexandria University, Alexandria 5424041, Egypt.",Veterinary sciences,2023-03-10,10.3390/vetsci10030212,0,carcass and blood parameters; plant extracts; essential oils; Ross 308; phytogenic feed additives; growth,"The purpose of this study was to determine the level of application and effectiveness of the use of vegetable feed additives from complex phytobiotic feed additives (CPFA) in the diets of broiler chickens, as well as their effects on growth indicators, carcass characters and blood profile. A total of 258 Ross 308 chicks were divided into six dietary regimens, including: a basal diet without additives as a first control group (CON); the second group received a basal diet supplemented with 200 g/t in the starter phase and 100 g/t in the grower and finisher phase; the third group-400 g/t and 200 g/t; the fourth group-600 g/t and 300 g/t; the fifth group-800 g/t and 400 g/t; and the sixth group-1000 g/t and 500 g/t of a complex phytobiotic supplement based on tannins, respectively. The CPFA contains the following: tannins 36.8-55.2%, eugenol 0.4-0.6%, cinnamon aldehyde 0.8-1.2%, zinc-methionine 1.6-2.4%, calcium butyrate 8-12%, silicon dioxide 1.2-1.8% and dextrose up to 100%. The maximum introduction of phytobiotics (1000 g/t) at 7 days of age leads to a decrease in the live weight of broilers which reduced by 8.27% (p < 0.05) compared to the minimum level of phytobiotics (200 g/t). From 15-21 days, the live weight was significant between the supplemented and control groups and represented 396.21, 384.81 and 384.16 vs. 316.91 g for the CPFA 4, CPFA 5, CPFA 1 and control group, respectively. Furthermore, the same trend was recorded in the average daily gain during the periods between 15-21 and 22-28 days of the experiment. Feeding CPFA had a positive effect on the carcass indicators, except for the feeding of CPFA 3 in the amount of 600 g/t in the starter phase and 300 g/t in the grower and finish phases, which recorded the lowest weight in relation to the CPFA 1 and 2 groups and represented 1309.58 vs. 1460.06 and 1456.52 g, respectively, and the difference was significant. The inclusion of CPFA in poultry diets contributed to an increase in lung mass in the experimental groups relative to the control group, except for the CPFA 5 group which represented the lowest weight of lung mass (6.51 g) and the differences were significant between the CPFA 2 and CPFA 3 and the control groups. The highest concentration of leukocytes was observed during the experiment period in the group of poultry receiving phytobiotics (CPFA 3), which significantly exceeded the control group by 2.37 × 109/L. A significant decrease in the level of cholesterol was recorded in the CPFA groups when compared to the control group and represented 2.83 vs. 3.55 mmol/L, respectively. Consequently, the introduction of vegetable feed additives from complex phytobiotic feed additives (CPFA) in the diets of Ross 308 chicks had a positive effect on the growth production, the carcass yield, the mass of the pectoral muscles and the mass of the lungs. Moreover, it did not cause a harmful effect on the biochemical parameters of the blood.",Castanea,,,
