pmid,title,authors,affiliations,journal,pub_date,doi,citations,keywords,abstract,search_query,impact_factor,quartile,journal_full_name
36729095,Plant Gall Diversity in Burned Semi-natural Grasslands in Japan.,Koyama Asuka; Ide Tatsuya,"Center for Biodiversity and Climate Change, Forestry and Forest Products Research Institute, 1 Matsunosato, Tsukuba, Ibaraki 305-8687, Japan.; Department of Zoology, National Museum of Nature and Science, 4-1-1 Amakubo, Tsukuba, Ibaraki 305-0005, Japan.",Journal of insect science (Online),2023-01-01,10.1093/jisesa/iead005,0,cynipid gall wasp; Animals; Plants; insect-gall diversity; Quercus; Trees; oak; Wasps; Grassland; Plant Tumors; burning; Japan,"We surveyed woody plants, including oaks and chestnuts (Quercus L. and Castanea Mill.), and recorded the inhabiting galls induced by oak gall wasps (Hymenoptera: Cynipidae: Cynipini) at seven Japanese semi-natural grassland sites maintained by traditional regular burning with two of the seven abandoned grassland areas. Woody plants were established in all burned and abandoned grasslands. Oak species were found at four of the seven sites. In total, 15 types of cynipid galls were recorded at all four sites where oak species were found. However, the occurrence of species was site-specific for host trees and cynipid galls. Although a few ecological studies of oak gall wasps inhabiting grassland environments, which have rapidly decreased in recent decades, have been conducted, this study suggests that semi-natural grasslands may be potential habitats for oak gall wasps and their host trees, and we provide a checklist of oak gall wasps with host oak records in semi-natural grasslands throughout Japan.",chestnut,2.2,Q1,Journal of insect science (Online)
36826889,Fluorescent Carbon Dots from Food Industry By-Products for Cell Imaging.,Mancini Federica; Menichetti Arianna; Degli Esposti Lorenzo; Montesi Monica; Panseri Silvia; Bassi Giada; Montalti Marco; Lazzarini Laura; Adamiano Alessio; Iafisco Michele,"Institute of Science, Technology and Sustainability for Ceramics (ISSMC), National Research Council (CNR), 48018 Faenza, Italy.; Department of Chemistry ""Giacomo Ciamician"", Alma Mater Studiorum-Università di Bologna, 40126 Bologna, Italy.; Department of Neuroscience, Imaging and Clinical Sciences, University of Studies ""G. D'Annunzio"", 66100 Chieti, Italy.; Institute of Materials for Electronics and Magnetism (IMEM), National Research Council (CNR), 43124 Parma, Italy.",Journal of functional biomaterials,2023-02-07,10.3390/jfb14020090,0,food by-products; photoluminescence; carbon dots; bioimaging; circular economy; pH sensing,"Herein, following a circular economy approach, we present the synthesis of luminescent carbon dots via the thermal treatment of chestnut and peanut shells, which are abundant carbon-rich food industry by-products. As-synthesized carbon dots have excellent water dispersibility thanks to their negative surface groups, good luminescence, and photo-stability. The excitation-emission behaviour as well as the surface functionalization of these carbon dots can be tuned by changing the carbon source (chestnuts or peanuts) and the dispersing medium (water or ammonium hydroxide solution). Preliminary in vitro biological data proved that the samples are not cytotoxic to fibroblasts and can act as luminescent probes for cellular imaging. In addition, these carbon dots have a pH-dependent luminescence and may, therefore, serve as cellular pH sensors. This work paves the way towards the development of more sustainable carbon dot production for biomedical applications.",chestnut,2.0,Q3,Journal of theoretical biology
33368259,Drug interactions of natural supplements in dermatology: a review.,Hadeler Edward K; Maderal Andrea D,"Dr. Phillip Frost Department of Dermatology and Cutaneous Surgery, University of Miami, Miller School of Medicine, Miami, FL, USA.",International journal of dermatology,2020-12-23,10.1111/ijd.15389,0,Drug Interactions; Dietary Supplements; Polypodium; Phytotherapy; Dermatology; Humans,"Limited information is available on the drug-drug interactions of natural supplements in dermatology. Many natural supplements are available over the counter, but drug-drug interactions can occur. This study reviews the clinical use and drug interactions of six natural supplements commonly recommended in dermatology: nicotinic acid (nicotinamide), polypodium leucotomos (heliocare), turmeric, horse chestnut seed extract, zinc, and N-acetylcysteine. We reviewed the drug-drug interactions of each supplement using the PubMed database and IBM Micromedex. For nicotinic acid, zinc, horse chestnut, and N-acetylcysteine, IBM Micromedex generated 11, 23, one, and two results, respectively. Further review of literature from PubMed identified two drug interactions with polypodium leucotomos, two with turmeric, and two more with zinc. Notable interactions included an increased risk of myopathy and rhabdomyolysis when nicotinic acid is taken by patients using statins, an increased risk of bleeding associated with horse chestnut seed, especially when used in combination with warfarin, and reduced plasma concentration in many drugs when taken with zinc. Furthermore, N-acetylcysteine may interfere with concentrations of other medications used in the psychiatric setting, and polypodium leucotomos and turmeric may interfere with the CYP metabolic pathway, which may affect drugs metabolized by this pathway. Prior to recommending a treatment, dermatologists should foster awareness of these interactions. In order to advance the practice as a whole, research should continue to evaluate the drug interactions of these natural supplements.",chestnut,1.6,Q4,International ophthalmology
33516022,Review: Chestnut and quebracho tannins in pig nutrition: the effects on performance and intestinal health.,Caprarulo V; Giromini C; Rossi L,"Department of Health, Animal Science and Food Safety, University of Milan, 20133 Milan, Italy. Electronic address: valentina.caprarulo@unimi.it.; Department of Health, Animal Science and Food Safety, University of Milan, 20133 Milan, Italy; CRC I-WE (Coordinating Research Center: Innovation for Well-Being and Environment), Università degli Studi di Milano, 20134 Milan, Italy.; Department of Health, Animal Science and Food Safety, University of Milan, 20133 Milan, Italy.",Animal : an international journal of animal bioscience,2020-12-17,10.1016/j.animal.2020.100064,0,Anacardiaceae; Feed supplements; Livestock production; Fagaceae; Swine; Natural extract; Diet; Polyphenol; Plant Extracts; Tannins; Animals,"Natural extracts are frequently adopted as a valuable alternative to antibiotics in intensive animal farming. Their diverse bioactive constituents such as phytosterols, glucosinolates, carotenoids and polyphenols have shown antioxidant, anti-inflammatory and antibacterial effects. Tannins are the largest class of polyphenol compounds of plant extracts, which can be classified into two hydrolysable or condensed subgroups. Poultry and swine nutrition are the most important sectors in which tannins have been used, firstly adopting tannin-rich feedstuffs and more recently, using tannin extracts from different plants. Several commercial products are available containing tannins extracted from the European chestnut tree (Castanea sativa Mill.) and the American quebracho (Schinopsis spp.). Tannins extracted from these plants have been applied on intensive swine farms due to their ability to improve animal performance and health. These positive and prominent effects are frequently associated with the antinutritional effects in reducing feed palatability, digestibility and protein utilization of feed. Some criticisms and contrasting results regarding pig performance and intestinal health have been reported. This paper provides an overview of the effects of chestnut and quebracho tannins on growth performance and intestinal health of pigs in order to clarify the appropriate dosage and response in the various physiological stages.",chestnut,1.5,Q3,International Journal of Plant Sciences
36554850,Protective Effect of Thyme and Chestnut Honeys Enriched with Bee Products against Benzo(a)pyrene-Induced DNA Damage.,Sánchez-Martín Vanesa; Haza Ana I; Iriondo-DeHond Amaia; Del Castillo María Dolores; Hospital Xavier F; Fernández Manuela; Hierro Eva; Morales Paloma,"Departamento de Nutrición y Ciencia de los Alimentos, Sección Departamental de Nutrición y Ciencia de los Alimentos, Facultad de Veterinaria, Universidad Complutense, 28040 Madrid, Spain.; Food Bioscience Group, Department of Bioactivity and Food Analysis, Instituto de Investigación en Ciencias de la Alimentación (CIAL) (CSIC-UAM), 28049 Madrid, Spain.; Departamento de Farmacia Galénica y Tecnología de los Alimentos, Sección Departamental de Farmacia Galénica y Tecnología de los Alimentos, Facultad de Veterinaria, Universidad Complutense, 28040 Madrid, Spain.",International journal of environmental research and public health,2022-12-17,10.3390/ijerph192416969,0,DNA Damage; Thymus Plant; honey; antioxidant; genotoxicity; Benzo(a)pyrene; benzo(a)pyrene; propolis; chemopreventive agent; DNA damage; comet assay; Honey; royal jelly; Propolis,"The aim of the present study was to validate the cytotoxicity, genotoxicity, and preventive potential against benzo(a)pyrene (BaP)-induced DNA damage of nine samples of thyme and chestnut honeys enriched with bee products (royal jelly and propolis, 2-10%). Cell viability was determined by the MTT [3-(4,5-dimethylthiazol-2-yl)-2,5-diphenyltetrazolium bromide] assay (0-250 mg/mL) to select nontoxic concentrations, and DNA damage (0.1-10 μg/mL) was evaluated by the alkaline single-cell gel electrophoresis or comet assay. Treatment with honey samples or royal jelly and propolis did not affect the viability of HepG2 cells up to 100 and 50 mg/mL, respectively. Treatment with 100 μM BaP significantly increased (p ≤ 0.001) the levels of the DNA strand breaks. None of the tested concentrations (0.1-10 μg/mL) of the honey samples (thyme and chestnut), royal jelly, and propolis caused DNA damage per se. All tested samples at all the concentrations used decreased the genotoxic effect of BaP. In addition, all mixtures of thyme or chestnut honeys with royal jelly or propolis showed a greater protective effect against BaP than the samples alone, being the thyme and chestnut honey samples enriched with 10% royal jelly and 10% propolis the most effective (70.4% and 69.4%, respectively). The observed protective effect may be associated with the phenolic content and antioxidant capacity of the studied samples. In conclusion, the thyme and chestnut honey samples enriched with bee products present potential as natural chemoprotective agents against the chemical carcinogen BaP.",chestnut,1.5,Q3,International Journal of Plant Sciences
36674276,Phytoremediation and Nurse Potential of Aloe Plants on Mine Tailings.,Marcelo-Silva João; Ramabu Masego; Siebert Stefan John,"Unit for Environmental Sciences and Management, North-West University, Potchefstroom 2520, South Africa.",International journal of environmental research and public health,2023-01-13,10.3390/ijerph20021521,0,"Biodegradation, Environmental; Plants; Soil Pollutants; Aloe; facilitation; Soil; metals; phytoextraction; restoration; Gold; Metals, Heavy","Mine tailings are a source of potentially toxic metals (PTMs) worldwide. Phytoremediation is a low-cost green technology that uses metal-tolerant plants to extract these contaminants and rehabilitate the soil. In mine tailing restoration efforts, it can be beneficial to introduce species that can facilitate the colonization of other plants (i.e., nurse plant syndrome). In this study, the phytoremediation and nursing potential of two species adapted to metalliferous soil, Aloe burgersfortensis and A. castanea, were evaluated for the first time. An experiment was performed with aloe plants grown in pots containing potting soil, platinum tailings, and gold tailings. Leaves were assessed for bioaccumulation of PTMs. Seeds of Bermuda grass and African daisy, two successional pioneers, were planted with the aloes and had their developmental parameters evaluated after 30 days. Allelopathic effects were also assessed, with seeds of the pioneer plants infused with root extracts of the aloes from the different soil treatments. A. castanea demonstrated greater potential for the bioaccumulation of Cd, Co, Mn, Ni, and Zn in the tailings. The presence of aloes benefited germination rates, leaf count, length, and plant biomass of grasses and daisies in the mine tailings, without significant allelopathic effects. Therefore, aloes-especially A. castanea-should be employed in the rehabilitation of metal-contaminated soils to extract metals and to aid the establishment of other species to enhance the phytoremediation processes.",Castanea,1.5,Q3,International Journal of Plant Sciences
34658691,Tree nut allergy.,Kuźmiński Andrzej; Przybyszewski Michał; Przybyszewska Justyna; Ukleja-Sokołowska Natalia; Pałgan Krzysztof; Bartuzi Zbigniew,"Department of Allergology, Clinical Immunology and Internal Diseases, Collegium Medicum in Bydgoszcz, Nicolaus Copernicus University in Torun, Poland.; Department of Nutrition and Dietetics, Collegium Medicum in Bydgoszcz, Nicolaus Copernicus University in Torun, Poland.",Postepy dermatologii i alergologii,2021-09-24,10.5114/ada.2021.108894,0,tree nut allergy,"From a botanical point of view, a nut is a kind of dry, closed, unbroken, single-seeded fruit, which has a ligneous pericarp made up of several fruiting bodies surrounded by one free semen. The term ""allergy to tree nuts"" includes allergies to almonds, Brazil nuts, cashew nuts, hazelnuts, chestnuts, macadamia nuts, pecan nuts, pistachios and walnuts. All tree nuts belong to five orders of plants: Rosaceae, Fagales, Sapindales, Ericales and Proteales. Allergies to tree nuts usually start in childhood, but unlike other food allergies, they rarely fade away and generally persist throughout life. They are one of the main causes of serious allergic reactions ending in death in both children and adults. The epidemiology of allergy to nuts is variable and depends mainly on the geographical zone and eating habits. In northern Europe, hazelnut allergy is prevalent, whereas in the USA the most common is allergy to peanuts and, when taking tree nuts into consideration, to walnuts. The diagnosis of allergies to nuts is difficult and requires the use of the most modern research tools including molecular diagnostic techniques.",chestnut,,,
33176297,Science and Experience: Repairing a Fractured Medicine.,Loughlin Michael,"European Institute for Person Centred Health and Social Care, School of Biomedical Sciences, University of West London, London, United Kingdom, michael_loughlin@ymail.com.",Complementary medicine research,2020-11-11,10.1159/000511584,0,Scientism; Evidence-Based Medicine; Experience; Medicine; History of ideas; Medical philosophy,"Chestnut honey plays a positive role in strengthening the immune system as it contains vitamins, minerals and antioxidants. It, moreover, has both antibacterial and antiviral properties. This study aimed to examine how people consume chestnut honey as a form of traditional medicine and how it might protect them from COVID-19. This study was carried out on 177 people (who had been snowball sampled) from a province in Turkey where chestnut honey is widely produced. The data was collected using a 20-open/closed-question online questionnaire form that asked the participants to report their sociodemographic details, how they consume chestnut honey, and about COVID-19. 41.8% of the participants reported that they used chestnut honey to protect themselves against COVID-19, 40.7% believed that chestnut honey helped to make them immune against COVID-19, and 37.3% felt that chestnut honey could treat COVID-19. However, there was no significant relationship between the participants consuming chestnut honey and their either being tested for COVID-19 (p > 0.05, χ2 = 1.080) or testing positive for COVID-19 (p > 0.05, χ2 = 0.793). This study revealed that chestnut honey is a widely used remedy in Turkey for treating different health problems and for maintaining health. In contrast, it also demonstrated that consuming chestnut honey has no effect on protecting the participants from COVID-19.",chestnut,,,
36553794,Sweet Chestnut (Castanea sativa Mill.) Nutritional and Phenolic Composition Interactions with Chestnut Flavor Physiology.,Santos Maria João; Pinto Teresa; Vilela Alice,"University of Trás-os-Montes and Alto Douro, 5000 801 Vila Real, Portugal.; CITAB, Centre for the Research and Technology of Agro-Environmental and Biological Sciences and Inov4Agro, Institute for Innovation, Capacity Building and Sustainability of Agrifood Production, Department of Biology and Environmental, School of Life and Environmental, University of Trás-os-Montes and Alto Douro, 5000 801 Vila Real, Portugal.; CQ-VR, Chemistry Research Center, Department of Biology and Environmental, School of Life and Environmental, University of Trás-os-Montes and Alto Douro, 5000 801 Vila Real, Portugal.","Foods (Basel, Switzerland)",2022-12-14,10.3390/foods11244052,0,sweet chestnuts; flavor; gastronomy; chemical composition; health benefits; qualitative and sensory methods,"The European chestnut (Castanea sativa Mill.), is an environmentally and economically important species in Europe, mainly for fruit production. The chestnut fruit is well-known for its nutritional properties, namely its high concentration of carbohydrates (starch) and its low-fat content, as well as being one of the few fruits that do not contain gluten. Due to its chemical and nutritional characteristics beneficial to health, the sweet chestnut is a food recommended at different levels. The biochemistry of the mouth and nose of a human being is very complex. However, understanding the different interactions between the biochemistry of our sensory organs and food helps us to comprehend certain concepts, such as flavor and how it is involved in the sensory evaluation of the chestnuts. For the selection of high-quality products, it is necessary to develop reliable methods both from a qualitative and sensory point of view, and chestnut is a fruit with unique sensory characteristics that can be used in various gastronomic dishes, from main courses to desserts.",chestnut,,,
33475812,[Conservative treatment of varicose veins].,Stücker Markus,"Klinik für Dermatologie, Venerologie und Allergologie, Venenzentrum der Dermatologischen und Gefäßchirurgischen Kliniken, St. Josef Hospital, Ruhr-Universität Bochum, Gudrunstr. 56, 44791, Bochum, Deutschland. m.stuecker@klinikum-bochum.de.","Der Hautarzt; Zeitschrift fur Dermatologie, Venerologie, und verwandte Gebiete",2021-03-01,10.1007/s00105-020-04749-2,0,"Humans; Extract of horse chestnut seed; Treatment Outcome; Conservative Treatment; Compression; Compression Bandages; Extract of red vine leaf; Oxerutin; Varicose Veins; Stockings, Compression; Edema","The treatment of varicose veins is supposed to eliminate congestive symptoms and edema, heal skin complications and prevent complications. Surgical procedures, endovenous thermal procedures, endovenous chemical procedures and conservative measures are used for treatment. Often the invasive and conservative procedures are combined. A precise examination of the varicose veins is required for therapy planning; duplex sonography is the gold standard. Conservative therapy focuses on compression therapy with compression bandages and with compression stockings. Medical adaptive compression systems are also used in the decongestion phase. Extract from red vine leafs, extract from horse chestnut seed and oxerutin are available for oral drug therapy. Conservative therapy is especially indicated when treatment of symptomatic varicose veins is not possible or when symptomatic venous disease persists even after invasive therapy.",chestnut,,,
37764340,Identification of Antioxidative Hydrolyzable Tannins in Water Chestnut.,Uchikura Takashi; Miura Yuka; Yoshimura Morio; Ito Hideyuki; Amakura Yoshiaki,"Department of Pharmacognosy, College of Pharmaceutical Sciences, Matsuyama University, 4-2 Bunkyo-cho, Matsuyama 790-8578, Ehime, Japan.; Department of Nutritional Science, Faculty of Health and Welfare Science, Okayama Prefectural University, 111 Kuboki, Soja 719-1197, Okayama, Japan.","Molecules (Basel, Switzerland)",2023-09-11,10.3390/molecules28186563,0,trapadin A; Polymers; Lythraceae; Hydrolyzable Tannins; Eleocharis; antioxidant activity; Trapa genus; Antioxidants; Vegetables; hydrolyzable tannin; Plant Extracts; water chestnut,"Despite the various biological activities exhibited by water chestnut (the fruit of the Trapa genus), the phenolic compounds present in its extract require comprehensive characterization. Accordingly, we analyzed a 80% methanol extract of commercially available water chestnut and identified a new hydrolyzable tannin dimer termed trapadin A. Additionally, 22 known compounds, including 10 hydrolyzable tannin monomers and 2 dimers, were also detected in the extract. Spectroscopic and chemical methods were used to elucidate the structure of trapadin A, revealing it to be a hydrolyzable tannin dimer formed from units of tellimagrandin II and 1,2,3,6-tetra-O-galloyl-β-d-glucose. Moreover, the 1,1-diphenyl-2-picrylhydrazyl radical scavenging activity assay used to determine the half-maximal effective concentration values for the 23 compounds isolated from water chestnut indicated significant radical scavenging activity associated with hydrolyzable tannins. Notably, trapadin A, the new hydrolyzable tannin dimer, exhibited the highest activity value among the tested compounds.",chestnut,,,
33805750,Endophytic Fungi and Ecological Fitness of Chestnuts.,Nicoletti Rosario; Beccaro Gabriele Loris; Sekara Agnieszka; Cirillo Chiara; Di Vaio Claudio,"Research Center for Olive, Fruit and Citrus Crops, Council for Agricultural Research and Economics, 81100 Caserta, Italy.; Department of Agricultural Sciences, University of Naples Federico II, 80055 Portici, Italy.; Department of Agricultural, Forest and Food Sciences, University of Turin, 10095 Grugliasco, Italy.; Department of Horticulture, University of Agriculture, 31-425 Krakow, Poland.","Plants (Basel, Switzerland)",2021-03-13,10.3390/plants10030542,0,defensive mutualism; mycorrhizae; Castanea spp.; endophytes; plant growth promotion,"Chestnuts (Castanea spp.) are plants of relevant economic interest in the agro-sylvicultural contexts of mountain regions throughout the temperate zone, particularly in the northern hemisphere. In recent years, several biological adversities have repeatedly endangered species belonging to this genus, calling for coordinated actions addressed to contrast their decline. These actions have mainly focused on the control of key pests/pathogens and the improvement of resistance/tolerance by the plant host, while the role of microorganisms as mediators of interactions between plants and the noxious agents has been less considered, essentially by reason of a limited knowledge on their ecological impact. In line with the increasing awareness of the basic importance of microbial symbionts in regulating plant fitness in both natural and crop contexts, this paper offers an overview on the occurrence and effects of endophytic fungi of chestnuts.",chestnut,,,
34371666,Influence of Climate Change on Chestnut Trees: A Review.,Freitas Teresa R; Santos João A; Silva Ana P; Fraga Hélder,"Research Centre for the Research and Technology of Agro-Environmental and Biological Sciences (CITAB), University of Trás-os-Montes e Alto Douro (UTAD), P.O. Box 1013, 5000-801 Vila Real, Portugal.; Research Centre for Agricultural Sciences and Engineering, Department of Agronomy, University of Trás-os-Montes e Alto Douro (UTAD), P.O. Box 1013, 5000-801 Vila Real, Portugal.","Plants (Basel, Switzerland)",2021-07-16,10.3390/plants10071463,0,climate impact; Europe; Castanea; Mediterranean; climate change; adaptation measures; Castanea sativa,"The chestnut tree (Castanea spp.) is an important resource worldwide. It is cultivated due to the high value of its fruits and wood. The evolution between Castanea biodiversity and humans has resulted in the spread of chestnut genetic diversity. In 2019, the chestnut tree area worldwide was approximately 596 × 103 ha for fruit production (Southern Europe, Southwestern United States of America, and Asia). In Europe 311 × 103 t were produced. Five genetic poles can be identified: three in Greece, the northwest coast of the Iberian Peninsula, and the rest of the Mediterranean. Over the years, there have been some productivity changes, in part associated with climate change. Climate is considered one of the main drivers of biodiversity and ecosystem change. In the future, new challenges associated with climate change are expected, which could threaten this crop. It is essential to identify the impacts of climate change on chestnut trees, improving the current understanding of climate-tree interconnections. To deal with these projected changes adaptation strategies must be planned. This manuscript demonstrates the impacts of climate change on chestnut cultivation, reviewing the most recent studies on the subject. Furthermore, an analysis of possible adaptation strategies against the potentially negative impacts was studied.",chestnut,,,
